{"final_output_hashes":[{"evidence_type":"product_assurance_v2","path":"reviews/.harness/verifier/terminal-m5/generation/product-assurance.json","root":{"discovery":"explicit:reviews/.harness/fixtures/terminal-m5/synthetic-project-manifest.json","identity":"c2-synthetic-project","kind":"project","manifest_sha256":"5d6dafd369af7f1bd62579096008d01fad9c6f19c10ab6a101b2962444e9c10d"},"sha256":"873a873bdff0e3c446f038a514d24cebe8c43448238dcbe2d0a362922cd8f4bc"},{"evidence_type":"verifier_transaction","path":"reviews/.harness/verifier/terminal-m5/generation/verifier-transaction.json","root":{"discovery":"explicit:reviews/.harness/fixtures/terminal-m5/synthetic-project-manifest.json","identity":"c2-synthetic-project","kind":"project","manifest_sha256":"5d6dafd369af7f1bd62579096008d01fad9c6f19c10ab6a101b2962444e9c10d"},"sha256":"71242b9ec0de74af7be5c8e53f72fef8c1d8f57a5dd923b5bfc627dbda2b4930"},{"evidence_type":"verifier_publication_manifest","path":"reviews/.harness/verifier/terminal-m5/generation/publication-manifest.json","root":{"discovery":"explicit:reviews/.harness/fixtures/terminal-m5/synthetic-project-manifest.json","identity":"c2-synthetic-project","kind":"project","manifest_sha256":"5d6dafd369af7f1bd62579096008d01fad9c6f19c10ab6a101b2962444e9c10d"},"sha256":"e6ccc434bff071c8ba4cccf5ddcc2e35ee888fa115958081a4738e2cf8dba60f"}],"manifest":{"evidence_type":"verifier_publication_manifest","path":"reviews/.harness/verifier/terminal-m5/generation/publication-manifest.json","root":{"discovery":"explicit:reviews/.harness/fixtures/terminal-m5/synthetic-project-manifest.json","identity":"c2-synthetic-project","kind":"project","manifest_sha256":"5d6dafd369af7f1bd62579096008d01fad9c6f19c10ab6a101b2962444e9c10d"},"sha256":"e6ccc434bff071c8ba4cccf5ddcc2e35ee888fa115958081a4738e2cf8dba60f"},"mode":"committed","schema_version":"1.0.0","state":"committed","transaction_id":"verifier-7f710bc1c750881e"}
