{"final_output_hashes":[{"evidence_type":"product_assurance_v2","path":"reviews/.harness/verifier/terminal-m4/generation/product-assurance.json","root":{"discovery":"explicit:reviews/.harness/fixtures/terminal-m4/synthetic-project-manifest.json","identity":"c2-synthetic-project","kind":"project","manifest_sha256":"b69a685b15d63c31d94537bce504752dc9bee4f94ff59e2700bba1f7ac17301e"},"sha256":"fe487527cedc89c706304037b674e019f8a1d92ef63204c4280c2d6c6fe4cb55"},{"evidence_type":"verifier_transaction","path":"reviews/.harness/verifier/terminal-m4/generation/verifier-transaction.json","root":{"discovery":"explicit:reviews/.harness/fixtures/terminal-m4/synthetic-project-manifest.json","identity":"c2-synthetic-project","kind":"project","manifest_sha256":"b69a685b15d63c31d94537bce504752dc9bee4f94ff59e2700bba1f7ac17301e"},"sha256":"6b64e5c9b3a41283459aa7831dfc7ac49f933dacae10e6967aff890094404632"},{"evidence_type":"verifier_publication_manifest","path":"reviews/.harness/verifier/terminal-m4/generation/publication-manifest.json","root":{"discovery":"explicit:reviews/.harness/fixtures/terminal-m4/synthetic-project-manifest.json","identity":"c2-synthetic-project","kind":"project","manifest_sha256":"b69a685b15d63c31d94537bce504752dc9bee4f94ff59e2700bba1f7ac17301e"},"sha256":"aa6b085c4cbba8f167b09fc6914c455a27524a95c0d5a67ff2888f99b133aa71"}],"manifest":{"evidence_type":"verifier_publication_manifest","path":"reviews/.harness/verifier/terminal-m4/generation/publication-manifest.json","root":{"discovery":"explicit:reviews/.harness/fixtures/terminal-m4/synthetic-project-manifest.json","identity":"c2-synthetic-project","kind":"project","manifest_sha256":"b69a685b15d63c31d94537bce504752dc9bee4f94ff59e2700bba1f7ac17301e"},"sha256":"aa6b085c4cbba8f167b09fc6914c455a27524a95c0d5a67ff2888f99b133aa71"},"mode":"committed","schema_version":"1.0.0","state":"committed","transaction_id":"verifier-ed16c276cbec59ba"}
