{"final_output_hashes":[{"evidence_type":"product_assurance_v2","path":"reviews/.harness/verifier/terminal-m1/generation/product-assurance.json","root":{"discovery":"explicit:reviews/.harness/fixtures/terminal-m1/synthetic-project-manifest.json","identity":"c2-synthetic-project","kind":"project","manifest_sha256":"c4b8d95709994f81093641c7a4739267e8539b7d20a9d6dcb45552433c7104f6"},"sha256":"a2fcb70c95859ba7f1744318e9820d17913b8a34baf7f23d92e45b3769812b6a"},{"evidence_type":"verifier_transaction","path":"reviews/.harness/verifier/terminal-m1/generation/verifier-transaction.json","root":{"discovery":"explicit:reviews/.harness/fixtures/terminal-m1/synthetic-project-manifest.json","identity":"c2-synthetic-project","kind":"project","manifest_sha256":"c4b8d95709994f81093641c7a4739267e8539b7d20a9d6dcb45552433c7104f6"},"sha256":"4c6d6c0b42000502288bb875e06bc6b2bf9112a1b0a1ce959435cc2ab08fde08"},{"evidence_type":"verifier_publication_manifest","path":"reviews/.harness/verifier/terminal-m1/generation/publication-manifest.json","root":{"discovery":"explicit:reviews/.harness/fixtures/terminal-m1/synthetic-project-manifest.json","identity":"c2-synthetic-project","kind":"project","manifest_sha256":"c4b8d95709994f81093641c7a4739267e8539b7d20a9d6dcb45552433c7104f6"},"sha256":"f6e04a25039d1fe0120f2b2ddac0138fb59da66454a672537058d120be00744b"}],"manifest":{"evidence_type":"verifier_publication_manifest","path":"reviews/.harness/verifier/terminal-m1/generation/publication-manifest.json","root":{"discovery":"explicit:reviews/.harness/fixtures/terminal-m1/synthetic-project-manifest.json","identity":"c2-synthetic-project","kind":"project","manifest_sha256":"c4b8d95709994f81093641c7a4739267e8539b7d20a9d6dcb45552433c7104f6"},"sha256":"f6e04a25039d1fe0120f2b2ddac0138fb59da66454a672537058d120be00744b"},"mode":"committed","schema_version":"1.0.0","state":"committed","transaction_id":"verifier-075eecb1b6301483"}
