{"final_output_hashes":[{"evidence_type":"product_assurance_v2","path":"reviews/.harness/verifier/terminal-m4/evaluation-product/product-assurance.json","root":{"discovery":"explicit:reviews/.harness/fixtures/terminal-m4/synthetic-project-manifest.json","identity":"c2-synthetic-project","kind":"project","manifest_sha256":"b69a685b15d63c31d94537bce504752dc9bee4f94ff59e2700bba1f7ac17301e"},"sha256":"aa687ade17e377a28106239791e67ddf9d0e36c0048cf6e8caf39f8274ddd09a"},{"evidence_type":"verifier_transaction","path":"reviews/.harness/verifier/terminal-m4/evaluation-product/verifier-transaction.json","root":{"discovery":"explicit:reviews/.harness/fixtures/terminal-m4/synthetic-project-manifest.json","identity":"c2-synthetic-project","kind":"project","manifest_sha256":"b69a685b15d63c31d94537bce504752dc9bee4f94ff59e2700bba1f7ac17301e"},"sha256":"c93990720ba583b489113c01406ca73bf24026402f33ed0e1544260f60434774"},{"evidence_type":"verifier_publication_manifest","path":"reviews/.harness/verifier/terminal-m4/evaluation-product/publication-manifest.json","root":{"discovery":"explicit:reviews/.harness/fixtures/terminal-m4/synthetic-project-manifest.json","identity":"c2-synthetic-project","kind":"project","manifest_sha256":"b69a685b15d63c31d94537bce504752dc9bee4f94ff59e2700bba1f7ac17301e"},"sha256":"17e33a0ecee3344b5dc634318717c663b12f7ff39cc2c63498e630368776e8b6"}],"manifest":{"evidence_type":"verifier_publication_manifest","path":"reviews/.harness/verifier/terminal-m4/evaluation-product/publication-manifest.json","root":{"discovery":"explicit:reviews/.harness/fixtures/terminal-m4/synthetic-project-manifest.json","identity":"c2-synthetic-project","kind":"project","manifest_sha256":"b69a685b15d63c31d94537bce504752dc9bee4f94ff59e2700bba1f7ac17301e"},"sha256":"17e33a0ecee3344b5dc634318717c663b12f7ff39cc2c63498e630368776e8b6"},"mode":"committed","schema_version":"1.0.0","state":"committed","transaction_id":"verifier-a7397ef6f9177ca7"}
