{"final_output_hashes":[{"evidence_type":"product_assurance_v2","path":"reviews/.harness/verifier/terminal-m3/generation/product-assurance.json","root":{"discovery":"explicit:reviews/.harness/fixtures/terminal-m3/synthetic-project-manifest.json","identity":"c2-synthetic-project","kind":"project","manifest_sha256":"d01c561c76a1ea977076c19491de3f4654053c58b3f3e6161b8701f09fc22966"},"sha256":"2269c63fe5d6d66e7daef578bdfd231a951f8666bab72e4e3e9c48fe79033675"},{"evidence_type":"verifier_transaction","path":"reviews/.harness/verifier/terminal-m3/generation/verifier-transaction.json","root":{"discovery":"explicit:reviews/.harness/fixtures/terminal-m3/synthetic-project-manifest.json","identity":"c2-synthetic-project","kind":"project","manifest_sha256":"d01c561c76a1ea977076c19491de3f4654053c58b3f3e6161b8701f09fc22966"},"sha256":"3e4b9d1d768ed770230e6120bcc3e314870c9162f888e1892ceb5719807ae5ed"},{"evidence_type":"verifier_publication_manifest","path":"reviews/.harness/verifier/terminal-m3/generation/publication-manifest.json","root":{"discovery":"explicit:reviews/.harness/fixtures/terminal-m3/synthetic-project-manifest.json","identity":"c2-synthetic-project","kind":"project","manifest_sha256":"d01c561c76a1ea977076c19491de3f4654053c58b3f3e6161b8701f09fc22966"},"sha256":"36a5b569850df957fa7b2cc0f66b0f25ab2581409d3d38a07ea8bf61494002e9"}],"manifest":{"evidence_type":"verifier_publication_manifest","path":"reviews/.harness/verifier/terminal-m3/generation/publication-manifest.json","root":{"discovery":"explicit:reviews/.harness/fixtures/terminal-m3/synthetic-project-manifest.json","identity":"c2-synthetic-project","kind":"project","manifest_sha256":"d01c561c76a1ea977076c19491de3f4654053c58b3f3e6161b8701f09fc22966"},"sha256":"36a5b569850df957fa7b2cc0f66b0f25ab2581409d3d38a07ea8bf61494002e9"},"mode":"committed","schema_version":"1.0.0","state":"committed","transaction_id":"verifier-a771c6ca1b5c555c"}
