{"final_output_hashes":[{"evidence_type":"product_assurance_v2","path":"reviews/.harness/verifier/terminal-m1/evaluation-product/product-assurance.json","root":{"discovery":"explicit:reviews/.harness/fixtures/terminal-m1/synthetic-project-manifest.json","identity":"c2-synthetic-project","kind":"project","manifest_sha256":"c4b8d95709994f81093641c7a4739267e8539b7d20a9d6dcb45552433c7104f6"},"sha256":"8bc04206e5679b3f893c68609a46005103c65d9a9bd3a0bd48662b004936b362"},{"evidence_type":"verifier_transaction","path":"reviews/.harness/verifier/terminal-m1/evaluation-product/verifier-transaction.json","root":{"discovery":"explicit:reviews/.harness/fixtures/terminal-m1/synthetic-project-manifest.json","identity":"c2-synthetic-project","kind":"project","manifest_sha256":"c4b8d95709994f81093641c7a4739267e8539b7d20a9d6dcb45552433c7104f6"},"sha256":"daf10535188ed6bbc2b8e637b227ad5fb22e17ba37ce38ffbf303cd47f82942c"},{"evidence_type":"verifier_publication_manifest","path":"reviews/.harness/verifier/terminal-m1/evaluation-product/publication-manifest.json","root":{"discovery":"explicit:reviews/.harness/fixtures/terminal-m1/synthetic-project-manifest.json","identity":"c2-synthetic-project","kind":"project","manifest_sha256":"c4b8d95709994f81093641c7a4739267e8539b7d20a9d6dcb45552433c7104f6"},"sha256":"040d970a1266312bb0771b1f68140c36b013c1c073b1fd3b4d9ccfebb32a90a9"}],"manifest":{"evidence_type":"verifier_publication_manifest","path":"reviews/.harness/verifier/terminal-m1/evaluation-product/publication-manifest.json","root":{"discovery":"explicit:reviews/.harness/fixtures/terminal-m1/synthetic-project-manifest.json","identity":"c2-synthetic-project","kind":"project","manifest_sha256":"c4b8d95709994f81093641c7a4739267e8539b7d20a9d6dcb45552433c7104f6"},"sha256":"040d970a1266312bb0771b1f68140c36b013c1c073b1fd3b4d9ccfebb32a90a9"},"mode":"committed","schema_version":"1.0.0","state":"committed","transaction_id":"verifier-d1e9b10acd2e85ff"}
