{"final_output_hashes":[{"evidence_type":"product_assurance_v2","path":"reviews/.harness/verifier/terminal-m5/evaluation-product/product-assurance.json","root":{"discovery":"explicit:reviews/.harness/fixtures/terminal-m5/synthetic-project-manifest.json","identity":"c2-synthetic-project","kind":"project","manifest_sha256":"5d6dafd369af7f1bd62579096008d01fad9c6f19c10ab6a101b2962444e9c10d"},"sha256":"0480d279480697c7e3a21a514f8d8b6387324d30d95c6a7e4ac2baa35555607b"},{"evidence_type":"verifier_transaction","path":"reviews/.harness/verifier/terminal-m5/evaluation-product/verifier-transaction.json","root":{"discovery":"explicit:reviews/.harness/fixtures/terminal-m5/synthetic-project-manifest.json","identity":"c2-synthetic-project","kind":"project","manifest_sha256":"5d6dafd369af7f1bd62579096008d01fad9c6f19c10ab6a101b2962444e9c10d"},"sha256":"ce91e81e8b8a9577380ab40479d8eb2d5b2eb6e7bc19297575e9e7e8f1ffed45"},{"evidence_type":"verifier_publication_manifest","path":"reviews/.harness/verifier/terminal-m5/evaluation-product/publication-manifest.json","root":{"discovery":"explicit:reviews/.harness/fixtures/terminal-m5/synthetic-project-manifest.json","identity":"c2-synthetic-project","kind":"project","manifest_sha256":"5d6dafd369af7f1bd62579096008d01fad9c6f19c10ab6a101b2962444e9c10d"},"sha256":"05032844836a4fc939dd08ca1826e767064667849f55f2ecb22a63e3bc232eef"}],"manifest":{"evidence_type":"verifier_publication_manifest","path":"reviews/.harness/verifier/terminal-m5/evaluation-product/publication-manifest.json","root":{"discovery":"explicit:reviews/.harness/fixtures/terminal-m5/synthetic-project-manifest.json","identity":"c2-synthetic-project","kind":"project","manifest_sha256":"5d6dafd369af7f1bd62579096008d01fad9c6f19c10ab6a101b2962444e9c10d"},"sha256":"05032844836a4fc939dd08ca1826e767064667849f55f2ecb22a63e3bc232eef"},"mode":"committed","schema_version":"1.0.0","state":"committed","transaction_id":"verifier-5da0af5c124c0c48"}
